cris_id,title,publication_type,doi,doi_link,resolved_doi_link
12236895,Language Theories in IS Research – A Review,Forschungsartikel (Buchbeitrag),10.1007/978-3-7908-2336-3_5,https://doi.org/10.1007/978-3-7908-2336-3_5,https://link.springer.com/chapter/10.1007/978-3-7908-2336-3_5
4496445,Evaluating the Expressiveness of Domain Specific Modeling Languages using the Bunge-Wand-Weber Ontology,Forschungsartikel in Sammelband (Konferenz),10.1109/HICSS.2010.190,https://doi.org/10.1109/HICSS.2010.190,https://ieeexplore.ieee.org/document/5428539/
4493294,Explaining the Behavioral Intention Towards BI Implementation in Public Administrations: A Principal-agent Theory Approach,Forschungsartikel in Sammelband (Konferenz),10.1007/978-3-642-03516-6_34,https://doi.org/10.1007/978-3-642-03516-6_34,https://link.springer.com/chapter/10.1007/978-3-642-03516-6_34
4505399,Evaluation of ICT Investments in Public Administrations based on Business Process Models,Forschungsartikel in Sammelband (Konferenz),10.1007/978-3-540-85204-9_11,https://doi.org/10.1007/978-3-540-85204-9_11,https://link.springer.com/chapter/10.1007/978-3-540-85204-9_11
4510514,Inclusive Electronic Public Service Delivery – A Quantitative Analysis,Forschungsartikel (Zeitschrift),10.1080/10196780802420687,https://doi.org/10.1080/10196780802420687,https://www.tandfonline.com/doi/full/10.1080/10196780802420687
4503760,TCO-as-a-Service - Servicebasierte Lebenszyklusrechnung für hybride Leistungsbündel,Forschungsartikel (Buchbeitrag),10.1007/978-3-642-11859-3_10,https://doi.org/10.1007/978-3-642-11859-3_10,https://link.springer.com/chapter/10.1007/978-3-642-11859-3_10
12237056,E-Services im Handel – Auffindung und Dokumentation von Potenzialen zur Digitalisierung von Dienstleistungen für Hersteller und Kunden,Forschungsartikel (Buchbeitrag),10.1007/978-3-642-11859-3_11,https://doi.org/10.1007/978-3-642-11859-3_11,https://link.springer.com/chapter/10.1007/978-3-642-11859-3_11
4510793,Enabling Individualized Recommendations and Dynamic Pricing of Value-Added Services through Willingness-to-Pay Data,Forschungsartikel (Zeitschrift),10.1007/s12525-010-0032-0,https://doi.org/10.1007/s12525-010-0032-0,https://link.springer.com/article/10.1007/s12525-010-0032-0
4525617,Configurative Service Engineering – A Rule-Based Configuration Approach for Versatile Service Processes in Corrective Maintenance,Forschungsartikel in Sammelband (Konferenz),10.1109/HICSS.2009.127,https://doi.org/10.1109/HICSS.2009.127,https://ieeexplore.ieee.org/document/4755474/
4510934,Ordnungsrahmen für die hybride Wertschöpfung,Forschungsartikel (Buchbeitrag),10.1007/978-3-7908-2099-7,https://doi.org/10.1007/978-3-7908-2099-7,https://link.springer.com/book/10.1007/978-3-7908-2099-7
4501345,A Generic Set Theory-based Pattern Matching Approach for the Analysis of Conceptual Models,Forschungsartikel in Sammelband (Konferenz),10.1007/978-3-642-04840-1_6,https://doi.org/10.1007/978-3-642-04840-1_6,https://link.springer.com/chapter/10.1007/978-3-642-04840-1_6
4493150,Formalizing Linguistic Conventions for Conceptual Models,Forschungsartikel in Sammelband (Konferenz),10.1007/978-3-642-04840-1_8,https://doi.org/10.1007/978-3-642-04840-1_8,https://link.springer.com/chapter/10.1007/978-3-642-04840-1_8
4484553,Adaptive Reference Modeling. Integrating Configurative and Generic Adaptation Techniques for Information Models,Forschungsartikel (Buchbeitrag),10.1007/978-3-7908-1966-3_2,https://doi.org/10.1007/978-3-7908-1966-3_2,https://link.springer.com/chapter/10.1007/978-3-7908-1966-3_2
12238508,Anpassung von Referenzmodellen mit adapt(x),Forschungsartikel (Buchbeitrag),10.1007/978-3-7908-1994-6_4,https://doi.org/10.1007/978-3-7908-1994-6_4,https://link.springer.com/chapter/10.1007/978-3-7908-1994-6_4
12238593,Fachkonzept eines konfigurativen Referenzmodellierungswerkzeugs,Forschungsartikel (Buchbeitrag),10.1007/978-3-7908-1994-6_2,https://doi.org/10.1007/978-3-7908-1994-6_2,https://link.springer.com/chapter/10.1007/978-3-7908-1994-6_2
4511079,Perspectives on Process Documentation - A Case Study,Forschungsartikel (Buchbeitrag),10.1007/978-1-4020-5347-4_19,https://doi.org/10.1007/978-1-4020-5347-4_19,https://link.springer.com/chapter/10.1007/978-1-4020-5347-4_19
12238916,Enterprise System introduction with Controlling Enabled Configurative Information Models,Forschungsartikel in Sammelband (Konferenz),10.1109/WETICE.2006.38,https://doi.org/10.1109/WETICE.2006.38,https://ieeexplore.ieee.org/document/4092224/
12239075,The ProKMuni-Platform - Process Oriented Knowledge Management for Municipalities,Forschungsartikel in Sammelband (Konferenz),10.4018/978-1-59140-822-2.ch008,https://doi.org/10.4018/978-1-59140-822-2.ch008,https://doi.org/10.4018/978-1-59140-822-2.ch008
4497353,A Web Based Platform for the Design of Administrational Reference Process Models,Forschungsartikel in Sammelband (Konferenz),10.1007/978-3-540-30480-7_18,https://doi.org/10.1007/978-3-540-30480-7_18,https://link.springer.com/chapter/10.1007/978-3-540-30480-7_18
4497498,e-Government Success Factors,Forschungsartikel in Sammelband (Konferenz),10.1007/978-3-540-30078-6_87,https://doi.org/10.1007/978-3-540-30078-6_87,https://link.springer.com/chapter/10.1007/978-3-540-30078-6_87
12239159,Enabling Widespread Configuration of Conceptual Models - An XML Approach,Forschungsartikel in Sammelband (Konferenz),10.1007/978-3-642-12186-9_64,https://doi.org/10.1007/978-3-642-12186-9_64,https://link.springer.com/chapter/10.1007/978-3-642-12186-9_64
4511777,Online-Produktkonfiguratoren – Status quo und Entwicklungsperspektiven,Forschungsartikel (Buchbeitrag),10.1007/978-3-642-11859-3_6,https://doi.org/10.1007/978-3-642-11859-3_6,https://link.springer.com/chapter/10.1007/978-3-642-11859-3_6
4495435,"Vertriebsinformationssysteme - Standardisierung, Individualisierung, Hybridisierung und Internetisierung",Fachbuch (Herausgegebenes Buch),10.1007/978-3-642-11859-3,https://doi.org/10.1007/978-3-642-11859-3,https://link.springer.com/book/10.1007/978-3-642-11859-3
4515742,Developing Maturity Models for IT Management – A Procedure Model and its Application,Forschungsartikel (Zeitschrift),10.1007/s12599-009-0044-5,https://doi.org/10.1007/s12599-009-0044-5,https://link.springer.com/article/10.1007/s12599-009-0044-5
4515673,Entwicklung von Reifegradmodellen für das IT-Management – Vorgehensmodell und praktische Anwendung,Forschungsartikel (Zeitschrift),10.1007/s11576-009-0167-9,https://doi.org/10.1007/s11576-009-0167-9,https://link.springer.com/article/10.1007/s11576-009-0167-9
12239897,Integration von Sach- und Dienstleistungen – Ausgewählte Internetquellen zur hybriden Wertschöpfung,Forschungsartikel (Zeitschrift),10.1365/s11576-008-0050-0,https://doi.org/10.1365/s11576-008-0050-0,https://link.springer.com/article/10.1365/s11576-008-0050-0
12240210,The Application of Taxonomies in the Context of Configurative Reference Modelling,Forschungsartikel in Sammelband (Konferenz),10.1007/978-3-540-78246-9_44,https://doi.org/10.1007/978-3-540-78246-9_44,https://link.springer.com/chapter/10.1007/978-3-540-78246-9_44
4510094,Epistemological Perspectives on IS-Development - A Consensus-Oriented Approach on Conceptual Modeling,Forschungsartikel in Sammelband (Konferenz),10.1007/11590019_71,https://doi.org/10.1007/11590019_71,https://link.springer.com/chapter/10.1007/11590019_71
4515328,Das Data-Warehouse-Konzept im CRM,Forschungsartikel (Buchbeitrag),10.1007/978-3-663-10414-8_7,https://doi.org/10.1007/978-3-663-10414-8_7,https://link.springer.com/chapter/10.1007/978-3-663-10414-8_7
4506224,Prozess- und Informationsmanagement für das CRM,Forschungsartikel (Buchbeitrag),10.1007/978-3-642-55959-4_7,https://doi.org/10.1007/978-3-642-55959-4_7,https://link.springer.com/chapter/10.1007/978-3-642-55959-4_7
4501420,Wissensmanagement mit Referenzmodellen. Konzepte für die Anwendungssystem- und Organisationsgestaltung,Fachbuch (Herausgegebenes Buch),10.1007/978-3-642-52449-3,https://doi.org/10.1007/978-3-642-52449-3,https://link.springer.com/book/10.1007/978-3-642-52449-3
4483248,Betriebswirtschaftliche Herausforderungen durch Data-Warehouse-Technologien,Forschungsartikel (Buchbeitrag),10.1007/978-3-642-56847-3_3,https://doi.org/10.1007/978-3-642-56847-3_3,https://link.springer.com/chapter/10.1007/978-3-642-56847-3_3
12241447,Teaching medium-sized ERP systems - a problem-based learning approach,Forschungsartikel in Sammelband (Konferenz),10.1007/b137171_94,https://doi.org/10.1007/b137171_94,https://link.springer.com/chapter/10.1007/b137171_94
4502378,Comparing Architectural Styles for Service-oriented Architectures – a REST vs. SOAP case study,Forschungsartikel in Sammelband (Konferenz),10.1007/b137171_22,https://doi.org/10.1007/b137171_22,https://link.springer.com/chapter/10.1007/b137171_22
4523051,Open Source Public Sector Business Intelligence Systems,Forschungsartikel in Sammelband (Konferenz),10.1007/978-0-387-68772-8_29,https://doi.org/10.1007/978-0-387-68772-8_29,https://link.springer.com/chapter/10.1007/978-0-387-68772-8_29
12242543,"Analysis of E-Inclusion Projects in Russia, Austria and Switzerland",Forschungsartikel (Zeitschrift),10.1108/17415651011071019,https://doi.org/10.1108/17415651011071019,https://www.emerald.com/insight/content/doi/10.1108/17415651011071019/full/html
4510021,"Forschungsmethodik einer Integrationsdisziplin - Eine Fortführung und Ergänzung zu Lutz Heinrichs ""Beitrag zur Geschichte der Wirtschaftsinformatik"" aus gestaltungsorientierter Perspektive",Forschungsartikel (Buchbeitrag),10.1007/978-3-7908-2336-3_1,https://doi.org/10.1007/978-3-7908-2336-3_1,https://link.springer.com/chapter/10.1007/978-3-7908-2336-3_1
4514647,Towards a Holistic Approach to Validating Conceptual Models,Forschungsartikel (Buchbeitrag),10.4018/978-1-59904-567-2.ch010,https://doi.org/10.4018/978-1-59904-567-2.ch010,https://www.igi-global.com/gateway/chapter/23418
4492733,Socio-Technical Perspectives on Design Science in IS Research,Forschungsartikel (Buchbeitrag),10.1007/978-0-387-70802-7_11,https://doi.org/10.1007/978-0-387-70802-7_11,https://link.springer.com/chapter/10.1007/978-0-387-70802-7_11
4490489,Socio-Technical Perspectives on Design Science in IS Research,Forschungsartikel in Sammelband (Konferenz),10.1007/978-0-387-70802-7_11,https://doi.org/10.1007/978-0-387-70802-7_11,https://link.springer.com/chapter/10.1007/978-0-387-70802-7_11
4502793,Semantic Business Process Analysis,Forschungsartikel (Buchbeitrag),10.1007/978-3-642-00416-2_9,https://doi.org/10.1007/978-3-642-00416-2_9,https://link.springer.com/chapter/10.1007/978-3-642-00416-2_9
4488175,Bausteinbasierte Modellierung von Prozesslandschaften mit der PICTURE-Methode am Beispiel der Universitätsverwaltung Münster,Forschungsartikel (Zeitschrift),10.1007/s11576-007-0063-0,https://doi.org/10.1007/s11576-007-0063-0,https://link.springer.com/article/10.1007/s11576-007-0063-0
12246123,Architektur eines konfigurativen Referenzmodellierungswerkzeugs – adapt(x),Forschungsartikel (Buchbeitrag),10.1007/978-3-7908-1994-6_3,https://doi.org/10.1007/978-3-7908-1994-6_3,https://link.springer.com/chapter/10.1007/978-3-7908-1994-6_3
12249031,"Ansätze zur Wiederverwendung von Software im Rahmen der Softwareindustrialisierung am Beispiel von Softwarekomponenten, serviceorientierten Architekturen und modellgetriebenen Architekturen",Forschungsartikel (Zeitschrift),10.1007/s11576-007-0051-4,https://doi.org/10.1007/s11576-007-0051-4,https://link.springer.com/article/10.1007/s11576-007-0051-4
4523668,Reuse Mechanisms in Situational Method Engineering,Forschungsartikel in Sammelband (Konferenz),10.1007/978-0-387-73947-2_8,https://doi.org/10.1007/978-0-387-73947-2_8,https://link.springer.com/chapter/10.1007/978-0-387-73947-2_8
4494942,Referenzmodelle für Workflow-Applikationen in technischen Dienstleistungen,Forschungsartikel (Buchbeitrag),10.1007/3-540-29473-2_26,https://doi.org/10.1007/3-540-29473-2_26,https://link.springer.com/chapter/10.1007/3-540-29473-2_26
4512470,A Framework for Situational and Evolutionary Language Adaptation in Information Systems Development,Forschungsartikel in Sammelband (Konferenz),10.1007/978-0-387-70802-7_9,https://doi.org/10.1007/978-0-387-70802-7_9,https://link.springer.com/chapter/10.1007/978-0-387-70802-7_9
4512881,Beziehungen zwischen behavioristischer und konstruktionsorientierter Forschung in der Wirtschaftsinformatik,Forschungsartikel (Buchbeitrag),10.1007/978-3-8350-9199-3_1,https://doi.org/10.1007/978-3-8350-9199-3_1,https://link.springer.com/chapter/10.1007/978-3-8350-9199-3_1
4513019,Multidimensional Knowledge Spaces for Strategic Management - Experiences at a Leading Manufacturer of Construction and Mining Equipment,Forschungsartikel in Sammelband (Konferenz),10.1109/DEXA.2004.1333521,https://doi.org/10.1109/DEXA.2004.1333521,https://ieeexplore.ieee.org/document/1333521/
24373408,Manifest: The role of law in an electronic world dominated by Web 2.0,Forschungsartikel (Zeitschrift),10.1007/s00450-009-0054-z,https://doi.org/10.1007/s00450-009-0054-z,https://link.springer.com/article/10.1007/s00450-009-0054-z
24372786,Single Source Information Systems to Connect Patient Care and Clinical Research,Forschungsartikel in Sammelband (Konferenz),10.3233/978-1-60750-044-5-61,https://doi.org/10.3233/978-1-60750-044-5-61,https://www.medra.org/servlet/aliasResolver?alias=iospressISSNISBN&issn=0926-9630&volume=150&spage=61
24372707,Single Source Informationssysteme - Nutzung von Routinedaten für die klinische Forschung,Forschungsartikel in Sammelband (Konferenz),10.3205/09gmds287,https://doi.org/10.3205/09gmds287,https://www.egms.de/static/en/meetings/gmds2009/09gmds287.shtml
4507393,Wertschöpfungsnetzwerke von Produzenten und Dienstleistern als Option zur Organisation der Erstellung hybrider Leistungsbündel,Forschungsartikel (Buchbeitrag),10.1007/978-3-7908-2056-0_1,https://doi.org/10.1007/978-3-7908-2056-0_1,https://link.springer.com/chapter/10.1007/978-3-7908-2056-0_1
4525757,Wertschöpfungsnetzwerke: Konzepte für das Netzwerkmanagement und Potenziale aktueller Informationstechnologien,Fachbuch (Herausgegebenes Buch),10.1007/978-3-7908-2056-0,https://doi.org/10.1007/978-3-7908-2056-0,https://link.springer.com/book/10.1007/978-3-7908-2056-0
16473626,The Integration of Task and Data Parallel Skeletons,Forschungsartikel (Zeitschrift),10.1142/S0129626402000896,https://doi.org/10.1142/S0129626402000896,https://www.worldscientific.com/doi/abs/10.1142/S0129626402000896
16476216,Measures of Dispersion and Cluster-Trees for Categorical Data,Forschungsartikel in Sammelband (Konferenz),10.1007/978-3-540-78246-9_20,https://doi.org/10.1007/978-3-540-78246-9_20,https://link.springer.com/chapter/10.1007/978-3-540-78246-9_20
16476535,The Value of the Last Digit. Statistical Fraud Detection with Digit Analysis,Forschungsartikel (Zeitschrift),10.1007/s11634-009-0048-5,https://doi.org/10.1007/s11634-009-0048-5,https://link.springer.com/article/10.1007/s11634-009-0048-5
16809077,Price Discovery and Investor Structure in Stock Index Futures,Forschungsartikel (Zeitschrift),10.1002/fut.20469,https://doi.org/10.1002/fut.20469,https://onlinelibrary.wiley.com/doi/10.1002/fut.20469
16809159,Do Individual Index Futures Investors Destabilize the Underlying Spot Market?,Forschungsartikel (Zeitschrift),10.1002/fut.20460,https://doi.org/10.1002/fut.20460,https://onlinelibrary.wiley.com/doi/10.1002/fut.20460
16820506,The Quality of Monetary Policy and Inflation Performance: Globalization and Its Aftermath,Forschungsartikel (Zeitschrift),10.2139/ssrn.1513263,https://doi.org/10.2139/ssrn.1513263,http://www.ssrn.com/abstract=1513263
16820590,Stock Return Seasonalities and Investor Structure: Evidence from China's B-Share Markets,Forschungsartikel (Zeitschrift),10.1016/j.chieco.2009.12.004,https://doi.org/10.1016/j.chieco.2009.12.004,https://linkinghub.elsevier.com/retrieve/pii/S1043951X0900159X
16820677,Real-Time Forecasting and Political Stock Market Anomalies: Evidence for the United States,Forschungsartikel (Zeitschrift),10.1111/j.1540-6288.2008.00196.x,https://doi.org/10.1111/j.1540-6288.2008.00196.x,https://onlinelibrary.wiley.com/doi/10.1111/j.1540-6288.2008.00196.x
16820763,German Monetary Unification and the Stability of the German M3 Money Demand Function,Forschungsartikel (Zeitschrift),10.1016/S0165-1765(99)00223-2,https://doi.org/10.1016/S0165-1765(99)00223-2,https://linkinghub.elsevier.com/retrieve/pii/S0165176599002232
16820849,Nonstationary Stochastic Seasonality and the German M2 Money Demand Function,Forschungsartikel (Zeitschrift),10.1016/S0014-2921(98)00068-3,https://doi.org/10.1016/S0014-2921(98)00068-3,https://linkinghub.elsevier.com/retrieve/pii/S0014292198000683
17004816,ID-Services: An RFID Middleware Architecture for Mobile Applications,Forschungsartikel (Zeitschrift),10.1007/s10796-009-9214-8,https://doi.org/10.1007/s10796-009-9214-8,https://link.springer.com/article/10.1007/s10796-009-9214-8
17006004,Die Rolle des Rechts in einer durch das Web 2.0 dominierten Welt,Forschungsartikel (Zeitschrift),10.1007/s11623-010-0130-3,https://doi.org/10.1007/s11623-010-0130-3,https://link.springer.com/article/10.1007/s11623-010-0130-3
17016532,Steering Sales Reps Through Cost Information: An Investigation into the Black Box of Cognitive References and Negotiation Behavior,Forschungsartikel (Zeitschrift),10.1016/j.ijresmar.2009.08.006,https://doi.org/10.1016/j.ijresmar.2009.08.006,https://linkinghub.elsevier.com/retrieve/pii/S0167811609000901
17057299,The Impact of New Media on Customer Relationships,Forschungsartikel (Zeitschrift),10.1177/1094670510375460,https://doi.org/10.1177/1094670510375460,https://journals.sagepub.com/doi/10.1177/1094670510375460
17070909,Learning Arrangements in Virtual Worlds,Forschungsartikel in Sammelband (Konferenz),10.1109/HICSS.2010.251,https://doi.org/10.1109/HICSS.2010.251,https://ieeexplore.ieee.org/document/5428766/
17070987,A Framework to Measure Benefits and Costs of Virtual Communities – The Case of the Berlin Stock Exchange,Forschungsartikel in Sammelband (Konferenz),10.1109/HICSS.2010.147,https://doi.org/10.1109/HICSS.2010.147,https://ieeexplore.ieee.org/document/5428689/
17072341,Impact of PPPs to Broadband Diffusion in Europe,Forschungsartikel (Zeitschrift),10.1108/17506160910997874,https://doi.org/10.1108/17506160910997874,https://www.emerald.com/insight/content/doi/10.1108/17506160910997874/full/html
17072420,A Concept for Mobile Ad-Hoc Messaging Networks (AMNet),Forschungsartikel (Zeitschrift),10.4018/jitwe.2009010101,https://doi.org/10.4018/jitwe.2009010101,https://www.igi-global.com/gateway/article/4027
17072734,An Approach to Ad-hoc Messaging Networks Using Time Shifted Propagation,Forschungsartikel (Zeitschrift),10.1.1.93.7074,https://doi.org/10.1.1.93.7074,https://doi.org/10.1.1.93.7074
17136354,How Regular Are Conjugate Exponential Families?,Forschungsartikel (Zeitschrift),10.1016/0167-7152(89)90117-X,https://doi.org/10.1016/0167-7152(89)90117-X,https://linkinghub.elsevier.com/retrieve/pii/016771528990117X
17136433,On the Attainment of the Cramér-Rao Bound in Lr-Differentiable Families of Distributions.,Forschungsartikel (Zeitschrift),10.1214/aos/1176347392,https://doi.org/10.1214/aos/1176347392,https://projecteuclid.org/journals/annals-of-statistics/volume-17/issue-4/On-the-Attainment-of-the-Cramer-Rao-Bound-in-mathbbL_r/10.1214/aos/1176347392.full
17139485,Bargaining solutions as social compromises,Forschungsartikel (Zeitschrift),10.1023/B:THEO.0000047489.82529.18,https://doi.org/10.1023/B:THEO.0000047489.82529.18,https://link.springer.com/article/10.1023/B:THEO.0000047489.82529.18
17139576,From poverty measurement to the measurement of downside risk,Forschungsartikel (Zeitschrift),10.1016/j.mathsocsci.2003.07.001,https://doi.org/10.1016/j.mathsocsci.2003.07.001,https://linkinghub.elsevier.com/retrieve/pii/S016548960300088X
17145856,European Stock Markets and the ECB's Monetary Policy Surprises,Forschungsartikel (Zeitschrift),10.1111/j.1468-2362.2008.00219.x,https://doi.org/10.1111/j.1468-2362.2008.00219.x,https://onlinelibrary.wiley.com/doi/10.1111/j.1468-2362.2008.00219.x
17145938,Policy Words and Policy Deeds: The ECB and the Euro,Forschungsartikel (Zeitschrift),10.1002/ijfe.342,https://doi.org/10.1002/ijfe.342,https://onlinelibrary.wiley.com/doi/10.1002/ijfe.342
17156794,Consumer Cocreation in New Product Development,Forschungsartikel (Zeitschrift),10.1177/1094670510375604,https://doi.org/10.1177/1094670510375604,https://journals.sagepub.com/doi/10.1177/1094670510375604
17156884,CRM in Data-Rich Multichannel Retailing Environments: A Review and Future Research Directions,Forschungsartikel (Zeitschrift),10.1016/j.intmar.2010.02.009,https://doi.org/10.1016/j.intmar.2010.02.009,https://journals.sagepub.com/doi/10.1016/j.intmar.2010.02.009
17156975,Customer Engagement as a New Perspective in Customer Management,Forschungsartikel (Zeitschrift),10.1177/1094670510375461,https://doi.org/10.1177/1094670510375461,https://journals.sagepub.com/doi/10.1177/1094670510375461
17157065,Delegation of Pricing Authority to the Sales Force: An Agency-Theoretic Perspective of its Determinants and Impact on Performance,Forschungsartikel (Zeitschrift),10.1016/j.ijresmar.2009.09.006,https://doi.org/10.1016/j.ijresmar.2009.09.006,https://linkinghub.elsevier.com/retrieve/pii/S0167811609000925
17157156,Determinants of the Variety of Routes to Market,Forschungsartikel (Zeitschrift),10.1016/j.ijresmar.2006.09.002,https://doi.org/10.1016/j.ijresmar.2006.09.002,https://linkinghub.elsevier.com/retrieve/pii/S0167811606000838
17157246,Sales Force Modeling: State of the Field and Research Agenda,Forschungsartikel (Zeitschrift),10.1007/s11002-010-9111-4,https://doi.org/10.1007/s11002-010-9111-4,https://link.springer.com/article/10.1007/s11002-010-9111-4
17157337,Special section on Enhancing Sales Force Productivity,Forschungsartikel (Zeitschrift),10.1016/j.ijresmar.2009.12.006,https://doi.org/10.1016/j.ijresmar.2009.12.006,https://linkinghub.elsevier.com/retrieve/pii/S0167811609000998
17261434,Pricing Two Heterogeneous Trees,Forschungsartikel (Zeitschrift),10.1017/S002210901100038X,https://doi.org/10.1017/S002210901100038X,https://www.cambridge.org/core/journals/journal-of-financial-and-quantitative-analysis/article/pricing-two-heterogeneous-trees/F6880304E82C51C1BF2D585A46F54024
17261516,Tractable Hedging with Additional Hedge Instruments,Forschungsartikel (Zeitschrift),10.1007/s11147-010-9056-z,https://doi.org/10.1007/s11147-010-9056-z,https://link.springer.com/article/10.1007/s11147-010-9056-z
17261598,Pricing and Upper Price Bounds of Relax Certificates,Forschungsartikel (Zeitschrift),10.1007/s11846-010-0047-0,https://doi.org/10.1007/s11846-010-0047-0,https://link.springer.com/article/10.1007/s11846-010-0047-0
17261680,On the Optimal Design of Insurance Contracts with Guarantees,Forschungsartikel (Zeitschrift),10.1016/j.insmatheco.2010.01.006,https://doi.org/10.1016/j.insmatheco.2010.01.006,https://linkinghub.elsevier.com/retrieve/pii/S0167668710000089
17261764,Discrete-Time Implementation of Continuous-Time Portfolio Strategies,Forschungsartikel (Zeitschrift),10.1080/13518470903075854,https://doi.org/10.1080/13518470903075854,https://www.tandfonline.com/doi/abs/10.1080/13518470903075854
17261846,What is the Impact of Stock Market Contagion on an Investor's Portfolio Choice?,Forschungsartikel (Zeitschrift),10.1016/j.insmatheco.2009.04.006,https://doi.org/10.1016/j.insmatheco.2009.04.006,https://linkinghub.elsevier.com/retrieve/pii/S0167668709000493
17261930,Can Tests Based on Option Hedging Errors Correctly Identify Volatility Risk Premia?,Forschungsartikel (Zeitschrift),10.1017/S0022109000014435,https://doi.org/10.1017/S0022109000014435,https://www.cambridge.org/core/journals/journal-of-financial-and-quantitative-analysis/article/recovering-risk-neutral-densities-from-option-prices-a-new-approach/2FBB151B3D1F4A0B2E60C6C29D0D7039
17262011,Optimal Derivatives Strategies with Discrete Rebalancing,Forschungsartikel (Zeitschrift),10.3905/JOD.2008.16.2.067,https://doi.org/10.3905/JOD.2008.16.2.067,https://jod.pm-research.com/content/16/2/67
17262105,Optimal Portfolios When Volatility can Jump,Forschungsartikel (Zeitschrift),10.1016/j.jbankfin.2007.09.015,https://doi.org/10.1016/j.jbankfin.2007.09.015,https://linkinghub.elsevier.com/retrieve/pii/S0378426607002853
17292119,Tracking down the business cycle: A dynamic factor model for Germany 1820-1913,Forschungsartikel (Zeitschrift),10.1016/j.eeh.2009.04.002,https://doi.org/10.1016/j.eeh.2009.04.002,https://linkinghub.elsevier.com/retrieve/pii/S0014498309000163
17292594,Stock markets and business cycle comovement in Germany before World War I: Evidence from spectral analysis,Forschungsartikel (Zeitschrift),10.1016/j.jmacro.2007.08.012,https://doi.org/10.1016/j.jmacro.2007.08.012,https://linkinghub.elsevier.com/retrieve/pii/S0164070407001310
17364233,The Role of Volatility Shocks and Rare Events in Long-Run Risk Models,Forschungsartikel (Zeitschrift),10.1016/j.jedc.2017.10.007,https://doi.org/10.1016/j.jedc.2017.10.007,https://linkinghub.elsevier.com/retrieve/pii/S016518891730221X
17364386,The Dynamics of Crises and the Equity Premium,Forschungsartikel (Zeitschrift),10.1093/rfs/hhv057,https://doi.org/10.1093/rfs/hhv057,https://academic.oup.com/rfs/article-lookup/doi/10.1093/rfs/hhv057
17453299,"Robust Portfolio Choice with Uncertainty about Jump and
Diffusion Risk",Forschungsartikel (Zeitschrift),10.1016/j.jbankfin.2013.08.023,https://doi.org/10.1016/j.jbankfin.2013.08.023,https://linkinghub.elsevier.com/retrieve/pii/S0378426613003543
17453456,Quit Behavior of Professional Tennis Players,Forschungsartikel (Zeitschrift),10.1177/1527002509336210,https://doi.org/10.1177/1527002509336210,https://journals.sagepub.com/doi/10.1177/1527002509336210
