cris_id,title,publication_type,doi,doi_link,resolved_doi_link
23028072,Effects of Information Security Risk Visualization on Managerial Decision Making,Forschungsartikel in Sammelband (Konferenz),10.14722/eurousec.2017.23010,https://doi.org/10.14722/eurousec.2017.23010,https://www.ndss-symposium.org/wp-content/uploads/2018/03/eurousec2017_10_Yildiz_paper.pdf
23027684,"Success through Trust, Control, and Learning? Contrasting the Drivers of SME Performance between Different Modes of Foreign Market Entry",Forschungsartikel (Zeitschrift),10.3390/admsci7020009,https://doi.org/10.3390/admsci7020009,https://www.mdpi.com/2076-3387/7/2/9
23025392,Recommendation and Configuration of Value-Added Services for Repurposing Electric Vehicle Batteries: A Vertical Software Prototype,Forschungsartikel in Sammelband (Konferenz),10.1109/CBI.2017.19,https://doi.org/10.1109/CBI.2017.19,https://ieeexplore.ieee.org/document/8010702/
23024605,ecr 2.0: A Modular Framework for Evolutionary Computation in R,Forschungsartikel in Sammelband (Konferenz),10.1145/3067695.3082470,https://doi.org/10.1145/3067695.3082470,https://dl.acm.org/doi/10.1145/3067695.3082470
23022744,flaccogui: Exploratory Landscape Analysis for Everyone,Forschungsartikel in Sammelband (Konferenz),10.1145/3067695.3082477,https://doi.org/10.1145/3067695.3082477,https://dl.acm.org/doi/10.1145/3067695.3082477
23013909,An open-data approach for quantifying the potential of taxi ridesharing,Forschungsartikel (Zeitschrift),10.1016/j.dss.2017.05.008,https://doi.org/10.1016/j.dss.2017.05.008,https://linkinghub.elsevier.com/retrieve/pii/S0167923617300866
23012586,Die Chancen der  Digitalisierung im Taximarkt nutzen: Liberalisieren und Verbraucherschutz stärken,Forschungsartikel (Zeitschrift),10.1007/s41025-017-0066-6,https://doi.org/10.1007/s41025-017-0066-6,https://link.springer.com/article/10.1007/s41025-017-0066-6
23010326,Guest Editors' Note: Special Issue on High-Level Parallel Programming and Applications,Forschungsartikel (Zeitschrift),10.1142/S0129626417020017,https://doi.org/10.1142/S0129626417020017,https://www.worldscientific.com/doi/abs/10.1142/S0129626417020017
23010248,Guest Editorial: High-Level Parallel Programming with Algorithmic Skeletons,Forschungsartikel (Zeitschrift),10.1007/s10766-017-0512-3,https://doi.org/10.1007/s10766-017-0512-3,https://link.springer.com/article/10.1007/s10766-017-0512-3
23004076,Building and Using an Ontology of Preference-Based Multiobjective Evolutionary Algorithms,Forschungsartikel (Buchbeitrag),10.1007/978-3-319-54157-0_28,https://doi.org/10.1007/978-3-319-54157-0_28,https://link.springer.com/chapter/10.1007/978-3-319-54157-0_28
23003991,Multi-objective Optimization for Liner Shipping Fleet Repositioning,Forschungsartikel (Buchbeitrag),10.1007/978-3-319-54157-0_42,https://doi.org/10.1007/978-3-319-54157-0_42,https://link.springer.com/chapter/10.1007/978-3-319-54157-0_42
4519887,Design and Implementation of a Toolkit for the Aspect-based Sentiment Analysis of Tweets,Forschungsartikel in Sammelband (Konferenz),10.1109/CBI.2017.68,https://doi.org/10.1109/CBI.2017.68,https://ieeexplore.ieee.org/document/8010742/
22981428,"Join, Stay, Leave: A Study of Direct-Selling Distributors",Arbeitspapier / Working Paper,10.2139/ssrn.2841403,https://doi.org/10.2139/ssrn.2841403,http://www.ssrn.com/abstract=2841403
4520517,"CrowdStrom – Analysis, Design, and Implementation of Processes for a Peer-to-Peer Service for Electric Vehicle Charging",Forschungsartikel (Buchbeitrag),10.1007/978-3-319-58307-5_18,https://doi.org/10.1007/978-3-319-58307-5_18,https://link.springer.com/chapter/10.1007/978-3-319-58307-5_18
22972761,Design and Development of an Event-driven In-memory Business Process Engine,Forschungsartikel in Sammelband (Konferenz),10.1109/CBI.2017.31,https://doi.org/10.1109/CBI.2017.31,https://ieeexplore.ieee.org/document/8010703/
22969331,Peer-to-peer Sharing and Collaborative Consumption Platforms: A Taxonomy and a Reproducible Analysis,Forschungsartikel (Zeitschrift),10.1007/s10257-017-0357-8,https://doi.org/10.1007/s10257-017-0357-8,https://link.springer.com/article/10.1007/s10257-017-0357-8
22969252,Leveraging social media to gain insights into service delivery: a study on Airbnb,Forschungsartikel (Zeitschrift),10.1007/s10257-017-0358-7,https://doi.org/10.1007/s10257-017-0358-7,https://link.springer.com/article/10.1007/s10257-017-0358-7
22968305,The Game of Trust: Using Behavioral Experiment as a Tool to Assess and Collect Trust-Related Data,Forschungsartikel in Sammelband (Konferenz),10.1007/978-3-319-59171-1_4,https://doi.org/10.1007/978-3-319-59171-1_4,https://link.springer.com/chapter/10.1007/978-3-319-59171-1_4
22967018,Leveraging TSP Solver Complementarity through Machine Learning,Forschungsartikel (Zeitschrift),10.1162/evco_a_00215,https://doi.org/10.1162/evco_a_00215,https://direct.mit.edu/evco/article/26/4/597-620/1075
22966940,OpenML: An R package to connect to the machine learning platform OpenML,Forschungsartikel (Zeitschrift),10.1007/s00180-017-0742-2,https://doi.org/10.1007/s00180-017-0742-2,https://link.springer.com/article/10.1007/s00180-017-0742-2
22964951,Application of the Design Thinking Approach to Process Redesign at an Insurance Company in Brazil,Forschungsartikel (Buchbeitrag),10.1007/978-3-319-58307-5,https://doi.org/10.1007/978-3-319-58307-5,https://link.springer.com/book/10.1007/978-3-319-58307-5
22956319,Development of a Domain-Specific Language for Run-Time Process Modelling – Making Use of Smart Glasses in BPM,Forschungsartikel in Sammelband (Konferenz),10.18420/in2017_85,https://doi.org/10.18420/in2017_85,https://dl.gi.de/handle/20.500.12116/4108
22951662,The international transmission channels of US supply and demand shocks: Evidence from a non-stationary dynamic factor model for the G7 countries,Forschungsartikel (Zeitschrift),10.1016/j.najef.2017.07.001,https://doi.org/10.1016/j.najef.2017.07.001,https://linkinghub.elsevier.com/retrieve/pii/S1062940817300335
22940073,Exploratory Landscape Analysis: Advanced Tutorial at GECCO 2017,Forschungsartikel in Sammelband (Konferenz),10.1145/3067695.3067696,https://doi.org/10.1145/3067695.3067696,https://dl.acm.org/doi/10.1145/3067695.3067696
22927536,"Agricultural output growth in a proto- and early industrial setting: evidence from sharecropping in Western Westphalia and the Lower Rhineland, c. 1740–1860",Forschungsartikel (Zeitschrift),10.1017/S0956793317000012,https://doi.org/10.1017/S0956793317000012,https://www.cambridge.org/core/journals/rural-history/article/agricultural-output-growth-in-a-proto-and-early-industrial-setting-evidence-from-sharecropping-in-western-westphalia-and-the-lower-rhineland-c-17401860/D341A4DCC0DA3B82892823B5C88792B3
22927458,"The timing and pattern of real wage divergence in pre-industrial Europe: evidence from Germany, c. 1500–1850",Forschungsartikel (Zeitschrift),10.1111/ehr.12419,https://doi.org/10.1111/ehr.12419,https://onlinelibrary.wiley.com/doi/10.1111/ehr.12419
22920178,Implementation of the Research Core Dataset at universities in North Rhine-Westphalia – An approach of a federal initiative,Forschungsartikel in Sammelband (Konferenz),10.17879/21299722960,https://doi.org/10.17879/21299722960,https://miami.uni-muenster.de/Record/17ffc5fa-e8e3-4a09-9fd6-74d84f630249
22919411,A case method for Sales and Operations Planning: a learning experience from Germany,Forschungsartikel (Zeitschrift),10.1590/0103-6513.219916,https://doi.org/10.1590/0103-6513.219916,https://www.scielo.br/j/prod/a/XfhQgJkknFjhysGrgCNcPrg/?lang=en
22913169,The transformation of the academic publishing market: multiple perspectives on innovation,Forschungsartikel (Zeitschrift),10.1007/s12525-017-0250-9,https://doi.org/10.1007/s12525-017-0250-9,https://link.springer.com/article/10.1007/s12525-017-0250-9
22912237,About depression babies and red diaper babies: Do macroeconomic experiences affect everybody's risk taking in the same way?,Forschungsartikel (Zeitschrift),10.1016/j.jbef.2017.02.004,https://doi.org/10.1016/j.jbef.2017.02.004,https://linkinghub.elsevier.com/retrieve/pii/S2214635017300059
22904791,Intelligent Decision Support for Data Purchase,Forschungsartikel in Sammelband (Konferenz),10.1145/3106426.3106434,https://doi.org/10.1145/3106426.3106434,https://dl.acm.org/doi/10.1145/3106426.3106434
22896099,Towards Efficient and Informative Omni-Channel Customer Relationship Management,Forschungsartikel in Sammelband (Konferenz),10.1007/978-3-319-70625-2_7,https://doi.org/10.1007/978-3-319-70625-2_7,https://link.springer.com/chapter/10.1007/978-3-319-70625-2_7
22895066,Stream Clustering of Chat Messages with Applications to Twitch Streams,Forschungsartikel in Sammelband (Konferenz),10.1007/978-3-319-70625-2_8,https://doi.org/10.1007/978-3-319-70625-2_8,https://link.springer.com/chapter/10.1007/978-3-319-70625-2_8
22889004,The Case for Herding is Stronger than You Think,Forschungsartikel (Zeitschrift),10.1016/j.jbankfin.2017.08.006,https://doi.org/10.1016/j.jbankfin.2017.08.006,https://linkinghub.elsevier.com/retrieve/pii/S0378426617301930
22885479,"Interaktive, digitale Einkaufserlebnisse in Innenstädten",Forschungsartikel (Zeitschrift),10.1365/s40702-017-0343-0,https://doi.org/10.1365/s40702-017-0343-0,https://link.springer.com/article/10.1365/s40702-017-0343-0
22885006,The Game of Trust: Using Behavioral Experiment as a Tool to Assess and Collect Trust-Related Data,Forschungsartikel (Buchbeitrag),10.1007/978-3-319-59171-1_4,https://doi.org/10.1007/978-3-319-59171-1_4,https://link.springer.com/chapter/10.1007/978-3-319-59171-1_4
22884767,User Profile Acquisition: A Comprehensive Framework to Support Personal Information Agents,Forschungsartikel in Sammelband (Konferenz),10.1109/LA-CCI.2017.8285719,https://doi.org/10.1109/LA-CCI.2017.8285719,https://ieeexplore.ieee.org/document/8285719/
22880834,Automatically Annotating Business Process Models with Ontology Concepts at Design-Time,Forschungsartikel in Sammelband (Konferenz),10.1007/978-3-319-70625-2_17,https://doi.org/10.1007/978-3-319-70625-2_17,https://link.springer.com/chapter/10.1007/978-3-319-70625-2_17
22879955,Social Influence in the Adoption of a B2B Loyalty Program: The Role of Elite Status Members,Forschungsartikel (Zeitschrift),10.1016/j.ijresmar.2017.08.003,https://doi.org/10.1016/j.ijresmar.2017.08.003,https://linkinghub.elsevier.com/retrieve/pii/S0167811617300563
22878818,Multi-objective Adaptation of a Parametrized GVGAI Agent Towards Several Games,Forschungsartikel in Sammelband (Konferenz),10.1007/978-3-319-54157-0_25,https://doi.org/10.1007/978-3-319-54157-0_25,https://link.springer.com/chapter/10.1007/978-3-319-54157-0_25
22878650,Guest Editorial Real-Time Strategy Games,Forschungsartikel (Zeitschrift),10.1109/TCIAIG.2016.2601116,https://doi.org/10.1109/TCIAIG.2016.2601116,https://ieeexplore.ieee.org/document/7782476/
22878572,MCTS/EA hybrid GVGAI players and game difficulty estimation,Forschungsartikel in Sammelband (Konferenz),10.1109/CIG.2016.7860384,https://doi.org/10.1109/CIG.2016.7860384,https://ieeexplore.ieee.org/document/7860384/
22876659,"Eliciting Value Propositions and Services 
in the Market for Electric Vehicle Charging",Forschungsartikel in Sammelband (Konferenz),10.1109/CBI.2017.48,https://doi.org/10.1109/CBI.2017.48,https://ieeexplore.ieee.org/document/8010721/
22867163,Learning Database Queries via Intelligent Semiotic Machines,Forschungsartikel in Sammelband (Konferenz),10.1109/LA-CCI.2017.8285698,https://doi.org/10.1109/LA-CCI.2017.8285698,https://ieeexplore.ieee.org/document/8285698/
22861464,Paving the Road to Electric Vehicles – A Patent Analysis of the Automotive Supply Industry,Forschungsartikel (Zeitschrift),10.1016/j.jclepro.2017.08.161,https://doi.org/10.1016/j.jclepro.2017.08.161,https://linkinghub.elsevier.com/retrieve/pii/S0959652617318905
22854462,Fish School Search with Algorithmic Skeletons,Forschungsartikel (Zeitschrift),10.1007/s10766-018-0564-z,https://doi.org/10.1007/s10766-018-0564-z,https://link.springer.com/article/10.1007/s10766-018-0564-z
22854151,Parameter Selection for Swarm Intelligence Algorithms: Case Study on Parallel Implementation of FSS,Forschungsartikel in Sammelband (Konferenz),10.1109/LA-CCI.2017.8285694,https://doi.org/10.1109/LA-CCI.2017.8285694,https://ieeexplore.ieee.org/document/8285694/
22853750,Zahlungsbereitschaften für deutsche Erfolge bei den Olympischen Winterspielen 2014 in Sotschi,Forschungsartikel (Zeitschrift),10.1007/s12662-017-0475-y,https://doi.org/10.1007/s12662-017-0475-y,https://link.springer.com/article/10.1007/s12662-017-0475-y
22846261,An Extended Mutation-Based Priority-Rule Integration Concept for Multi-Objective Machine Scheduling,Forschungsartikel in Sammelband (Konferenz),10.1109/SSCI.2017.8285224,https://doi.org/10.1109/SSCI.2017.8285224,https://ieeexplore.ieee.org/document/8285224/
22846185,A Pareto-Beneficial Sub-Tree Mutation for the Multi-Criteria Minimum Spanning Tree Problem,Forschungsartikel in Sammelband (Konferenz),10.1109/SSCI.2017.8285183,https://doi.org/10.1109/SSCI.2017.8285183,https://ieeexplore.ieee.org/document/8285183/
22846110,mcMST: A Toolbox for the Multi-Criteria Minimum Spanning Tree Problem,Forschungsartikel (Zeitschrift),10.21105/joss.00374,https://doi.org/10.21105/joss.00374,https://joss.theoj.org/papers/10.21105/joss.00374
22838044,Effects of Traditional Advertising and Social Messages on Brand-Building Metrics and Customer Acquisition,Forschungsartikel (Zeitschrift),10.1509/jm.15.0178,https://doi.org/10.1509/jm.15.0178,https://journals.sagepub.com/doi/10.1509/jm.15.0178
22836162,Normative Assessments in Empirical Business Ethics Research: Towards a Methodological Bridge across the Ontological Gap,Forschungsartikel (Buchbeitrag),10.1017/9781316584385,https://doi.org/10.1017/9781316584385,https://www.cambridge.org/core/books/cambridge-handbook-of-research-approaches-to-business-ethics-and-corporate-responsibility/F51482CADEDC7C9973AE299B04EAB1A3
14031837,Leveraging Test Case Generation in the Testing Process – An Integration of Human Oracles with Derived Oracles,Forschungsartikel in Sammelband (Konferenz),10.3233/978-1-61499-800-6-480,https://doi.org/10.3233/978-1-61499-800-6-480,https://www.medra.org/servlet/aliasResolver?alias=iospressISBN&isbn=978-1-61499-799-3&spage=480&doi=10.3233/978-1-61499-800-6-480
14031931,Checking Java Assertions Using Automated Test-Case Generation,Forschungsartikel in Sammelband (Konferenz),10.1007/978-3-319-27436-2_13,https://doi.org/10.1007/978-3-319-27436-2_13,https://link.springer.com/chapter/10.1007/978-3-319-27436-2_13
14055159,Towards Standardized and Seamless Integration of Expert Knowledge into Multi-objective Evolutionary Optimization Algorithms,Forschungsartikel in Sammelband (Konferenz),10.1007/978-3-319-54157-0_26,https://doi.org/10.1007/978-3-319-54157-0_26,https://link.springer.com/chapter/10.1007/978-3-319-54157-0_26
14059192,Developing a Common Understanding of IT Services – The Case of a German University,Forschungsartikel (Buchbeitrag),10.1007/978-3-319-58521-5_32DO-10.1007/978-3-319-58521-5_32,https://doi.org/10.1007/978-3-319-58521-5_32DO-10.1007/978-3-319-58521-5_32,https://doi.org/10.1007/978-3-319-58521-5_32DO-10.1007/978-3-319-58521-5_32
14059361,Giving IT Services a Theoretical Backing,Forschungsartikel in Sammelband (Konferenz),10.1007/978-3-319-58521-5_35DO-10.1007/978-3-319-58521-5_35,https://doi.org/10.1007/978-3-319-58521-5_35DO-10.1007/978-3-319-58521-5_35,https://doi.org/10.1007/978-3-319-58521-5_35DO-10.1007/978-3-319-58521-5_35
14072954,The United Nations Global Compact as a Facilitator of the Lockean Social Contract,Forschungsartikel (Zeitschrift),10.1007/s10551-017-3721-1,https://doi.org/10.1007/s10551-017-3721-1,https://link.springer.com/article/10.1007/s10551-017-3721-1
14077460,Grundlagen der Informationsmodellierung,Forschungsartikel (Buchbeitrag),10.1007/978-3-662-55362-6_2,https://doi.org/10.1007/978-3-662-55362-6_2,https://link.springer.com/chapter/10.1007/978-3-662-55362-6_2
14077627,Entwicklung und Anwendung der Cooperation Experience-Modellierungsmethode,Forschungsartikel (Buchbeitrag),10.1007/978-3-662-55362-6_2,https://doi.org/10.1007/978-3-662-55362-6_2,https://link.springer.com/chapter/10.1007/978-3-662-55362-6_2
14077707,Management von Informationsobjekten in hybriden Wertschöpfungsnetzwerken,Forschungsartikel (Buchbeitrag),10.1007/978-3-662-55362-6_3,https://doi.org/10.1007/978-3-662-55362-6_3,https://link.springer.com/chapter/10.1007/978-3-662-55362-6_3
14077787,Erfahrbarkeit von hybriden Wertschöpfungsnetzwerken: Die Cooperation Experience-App,Forschungsartikel (Buchbeitrag),10.1007/978-3-662-55362-6_3,https://doi.org/10.1007/978-3-662-55362-6_3,https://link.springer.com/chapter/10.1007/978-3-662-55362-6_3
14080564,Strategic Aspects of Cyber Risk Information Sharing,Forschungsartikel (Zeitschrift),10.1145/3124398,https://doi.org/10.1145/3124398,https://dl.acm.org/doi/10.1145/3124398
14085544,Legitimacy Strategies in Corporate Environmental Reporting: A Longitudinal Analysis of German DAX Companies’ Disclosed Objectives,Forschungsartikel (Zeitschrift),10.1007/s10551-017-3708-y,https://doi.org/10.1007/s10551-017-3708-y,https://link.springer.com/article/10.1007/s10551-017-3708-y
14094132,Ideological Materiality at Work: A Lacanian Approach,Forschungsartikel (Buchbeitrag),10.1007/978-3-319-49733-4_6,https://doi.org/10.1007/978-3-319-49733-4_6,https://link.springer.com/chapter/10.1007/978-3-319-49733-4_6
14099505,A new stock-price bubble with stochastically deflating trajectories,Forschungsartikel (Zeitschrift),10.1080/13504851.2017.1397846,https://doi.org/10.1080/13504851.2017.1397846,https://www.tandfonline.com/doi/full/10.1080/13504851.2017.1397846
14118908,"Forecasting market risk of portfolios: copula-Markov switching multifractal
approach",Forschungsartikel (Zeitschrift),10.1080/1351847X.2017.1400453,https://doi.org/10.1080/1351847X.2017.1400453,https://www.tandfonline.com/doi/full/10.1080/1351847X.2017.1400453
14119061,Size Distributions Reconsidered,Forschungsartikel (Zeitschrift),10.1080/07474938.2017.1417732,https://doi.org/10.1080/07474938.2017.1417732,https://www.tandfonline.com/doi/full/10.1080/07474938.2017.1417732
14134556,Innovationen für den Mittelstand – Ein prozessorientierter Leitfaden für KMU,Forschungsartikel (Buchbeitrag),10.1007/978-3-658-18778-1,https://doi.org/10.1007/978-3-658-18778-1,https://link.springer.com/book/10.1007/978-3-658-18778-1
14134637,A Novel Serious Game for Trust-Related Data Collection in Supply Chains,Forschungsartikel in Sammelband (Konferenz),10.1007/978-3-319-70111-0_11,https://doi.org/10.1007/978-3-319-70111-0_11,https://link.springer.com/chapter/10.1007/978-3-319-70111-0_11
14140590,Logistische Lieferantenentwicklung in der Automobilindustrie - Ein heuristischer Ansatz zur Auswahl von logistischen Entwicklungskandidaten,Forschungsartikel (Buchbeitrag),10.1007/978-3-8349-8847-8_5,https://doi.org/10.1007/978-3-8349-8847-8_5,https://link.springer.com/chapter/10.1007/978-3-8349-8847-8_5
14152796,Speculative Activity and Returns Volatility of Chinese Major Agricultural Commodity Futures,Forschungsartikel (Zeitschrift),10.1016/j.asieco.2017.12.003,https://doi.org/10.1016/j.asieco.2017.12.003,https://linkinghub.elsevier.com/retrieve/pii/S1049007817302828
16441643,The Impact of Routing Attacks on Pastry-Based P2P Online Social Networks,Forschungsartikel in Sammelband (Konferenz),10.1007/978-3-319-14325-5_30,https://doi.org/10.1007/978-3-319-14325-5_30,https://link.springer.com/chapter/10.1007/978-3-319-14325-5_30
16455305,Information Systems for Composite Materials: Requirements and Challenges,Forschungsartikel in Sammelband (Konferenz),10.4028/www.scientific.net/AMM.597.59,https://doi.org/10.4028/www.scientific.net/AMM.597.59,https://www.scientific.net/AMM.597.59
16460062,The Anatomy of Inflation: An Economic History Perspective,Forschungsartikel (Buchbeitrag),10.1007/978-981-10-0622-7_35-1,https://doi.org/10.1007/978-981-10-0622-7_35-1,https://link.springer.com/referenceworkentry/10.1007/978-981-10-0622-7_35-1
41475868,Social Bots: Human-Like by Means of Human Control?,Forschungsartikel (Zeitschrift),10.1089/big.2017.0044,https://doi.org/10.1089/big.2017.0044,https://www.liebertpub.com/doi/10.1089/big.2017.0044
41467021,"Urban Protests, Coups d’état and Post-Coup
Regime Change",Forschungsartikel (Zeitschrift),10.1515/peps-2017-0033,https://doi.org/10.1515/peps-2017-0033,https://www.degruyter.com/document/doi/10.1515/peps-2017-0033/html
41466944,"Youth Bulges, Insurrections, and Labor-Market Restrictions",Forschungsartikel (Zeitschrift),10.1007/s11127-018-0514-8,https://doi.org/10.1007/s11127-018-0514-8,https://link.springer.com/article/10.1007/s11127-018-0514-8
41459553,Bidding for firms with unknown characteristics,Forschungsartikel (Zeitschrift),10.1111/sjoe.12309,https://doi.org/10.1111/sjoe.12309,https://onlinelibrary.wiley.com/doi/10.1111/sjoe.12309
41446244,Short-Selling Bans and the Global Financial Crisis: Are they Interconnected?,Forschungsartikel (Zeitschrift),10.3790/aeq.64.2.159,https://doi.org/10.3790/aeq.64.2.159,https://elibrary.duncker-humblot.com/article/9983/short-selling-bans-and-the-global-financial-crisis-are-they-interconnected
41446085,Can we Learn from Down Under How to Rise Up in E-Government? A Comparative Analysis of the Public Sector Competences in the German and Australian Higher Education Systems,Forschungsartikel in Sammelband (Konferenz),10.24251/HICSS.2018.283,https://doi.org/10.24251/HICSS.2018.283,https://scholarspace.manoa.hawaii.edu/handle/10125/50171
41442278,"Pension Funds, Large Capital Inflows and Stock Returns in a Thin Market",Forschungsartikel (Zeitschrift),10.1017/S147474721800001X,https://doi.org/10.1017/S147474721800001X,https://www.cambridge.org/core/journals/journal-of-pension-economics-and-finance/article/pension-funds-large-capital-inflows-and-stock-returns-in-a-thin-market/F016FE6DE0ACFA823801D88F3B853F65
41398740,Challenges and Opportunities of Modularizing Textual Domain-Specific Languages,Forschungsartikel in Sammelband (Konferenz),10.5220/0006601903870395,https://doi.org/10.5220/0006601903870395,https://www.scitepress.org/Link.aspx?doi=10.5220/0006601903870395
41391457,Medizintechnische Anwendungen der additiven Fertigung,Forschungsartikel (Buchbeitrag),10.1007/978-3-658-17780-5,https://doi.org/10.1007/978-3-658-17780-5,https://link.springer.com/book/10.1007/978-3-658-17780-5
41373216,A process-oriented modeling approach for graphical development of mobile business apps,Forschungsartikel (Zeitschrift),10.1016/j.cl.2018.01.001,https://doi.org/10.1016/j.cl.2018.01.001,https://linkinghub.elsevier.com/retrieve/pii/S1477842417301215
54566197,Assessment of Peer-provider Potentials to Share Private Electric Vehicle Charging Stations,Forschungsartikel (Zeitschrift),10.1016/j.trd.2018.02.013,https://doi.org/10.1016/j.trd.2018.02.013,https://linkinghub.elsevier.com/retrieve/pii/S1361920916307003
54565885,Forecasting the Price of Gold,Forschungsartikel (Zeitschrift),10.1080/00036846.2015.1026580,https://doi.org/10.1080/00036846.2015.1026580,https://www.tandfonline.com/doi/full/10.1080/00036846.2015.1026580
54562564,Solving Scalarized Subproblems within Evolutionary Algorithms for Multi-Criteria Shortest Path Problems,Forschungsartikel in Sammelband (Konferenz),10.1007/978-3-030-05348-2_17,https://doi.org/10.1007/978-3-030-05348-2_17,https://link.springer.com/chapter/10.1007/978-3-030-05348-2_17
54533181,"Phronesis, Argumentation and Puzzle Solving in IS Research: Illustrating an Approach to Phronetic IS Research Practice",Forschungsartikel (Zeitschrift),10.1080/0960085X.2018.1435229d,https://doi.org/10.1080/0960085X.2018.1435229d,https://doi.org/10.1080/0960085X.2018.1435229d
54512934,Multiobjective evolutionary algorithms based on target region preferences,Forschungsartikel (Zeitschrift),10.1016/j.swevo.2018.02.006,https://doi.org/10.1016/j.swevo.2018.02.006,https://linkinghub.elsevier.com/retrieve/pii/S2210650217304698
54403524,Local Search Effects in Bi-Objective Orienteering,Forschungsartikel in Sammelband (Konferenz),10.1145/3205455.3205548,https://doi.org/10.1145/3205455.3205548,https://dl.acm.org/doi/10.1145/3205455.3205548
54374223,Eine Methode zur ex-ante Bestimmung des adäquaten Detaillierungsgrades in der Prozessmodellierung,Forschungsartikel (Buchbeitrag),10.1007/978-3-658-16262-7_5,https://doi.org/10.1007/978-3-658-16262-7_5,https://link.springer.com/chapter/10.1007/978-3-658-16262-7_5
54344694,Webcam Covering as Planned Behavior,Forschungsartikel in Sammelband (Konferenz),10.1145/3173574.3173754,https://doi.org/10.1145/3173574.3173754,https://dl.acm.org/doi/10.1145/3173574.3173754
54336355,Performance Assessment of Multi-Objective Evolutionary Algorithms With the R Package ecr,Forschungsartikel in Sammelband (Konferenz),10.1145/3205651.3208312,https://doi.org/10.1145/3205651.3208312,https://dl.acm.org/doi/10.1145/3205651.3208312
54336274,Parameterization of State-of-the-Art Performance Indicators: A Robustness Study Based on Inexact TSP Solvers,Forschungsartikel in Sammelband (Konferenz),10.1145/3205651.3208233,https://doi.org/10.1145/3205651.3208233,https://dl.acm.org/doi/10.1145/3205651.3208233
54317929,A Constraint-logic Object-oriented Language,Forschungsartikel in Sammelband (Konferenz),10.1145/3167132.3167260,https://doi.org/10.1145/3167132.3167260,https://dl.acm.org/doi/10.1145/3167132.3167260
54317853,An Operational Semantics for Constraint-logic Imperative Programming,Forschungsartikel (Buchbeitrag),10.1007/978-3-030-00801-7_5,https://doi.org/10.1007/978-3-030-00801-7_5,https://link.springer.com/chapter/10.1007/978-3-030-00801-7_5
54312012,Der Einfluss konkurrierender Verkehrsmittelalternativen auf den Schienenpersonenverkehr,Forschungsartikel (Zeitschrift),10.1007/s41025-018-0090-1,https://doi.org/10.1007/s41025-018-0090-1,https://link.springer.com/article/10.1007/s41025-018-0090-1
