cris_id,title,publication_type,doi,doi_link,resolved_doi_link
60017494,Unsupervised Multi-class Regularized Least-Squares Classification,Forschungsartikel in Sammelband (Konferenz),10.1109/ICDM.2012.71,https://doi.org/10.1109/ICDM.2012.71,https://ieeexplore.ieee.org/document/6413868/
60017229,Analysis of wind energy time series with kernel methods and neural networks,Forschungsartikel in Sammelband (Konferenz),10.1109/ICNC.2011.6022597,https://doi.org/10.1109/ICNC.2011.6022597,https://ieeexplore.ieee.org/document/6022597/
60017137,Speedy Local Search for Semi-Supervised Regularized Least-Squares,Forschungsartikel in Sammelband (Konferenz),10.1007/978-3-642-24455-1_8,https://doi.org/10.1007/978-3-642-24455-1_8,https://link.springer.com/chapter/10.1007/978-3-642-24455-1_8
60017045,Variance Scaling for EDAs Revisited,Forschungsartikel in Sammelband (Konferenz),10.1007/978-3-642-24455-1_16,https://doi.org/10.1007/978-3-642-24455-1_16,https://link.springer.com/chapter/10.1007/978-3-642-24455-1_16
60016953,Short-Term Wind Energy Forecasting Using Support Vector Regression,Forschungsartikel in Sammelband (Konferenz),10.1007/978-3-642-19644-7_29,https://doi.org/10.1007/978-3-642-19644-7_29,https://link.springer.com/chapter/10.1007/978-3-642-19644-7_29
60016859,Fast evolutionary maximum margin clustering,Forschungsartikel in Sammelband (Konferenz),10.1145/1553374.1553421,https://doi.org/10.1145/1553374.1553421,http://portal.acm.org/citation.cfm?doid=1553374.1553421
60016588,Frontiers of business intelligence and analytics 3.0: a taxonomy-based literature review and research agenda,Forschungsartikel (Zeitschrift),10.1007/s40685-020-00108-y,https://doi.org/10.1007/s40685-020-00108-y,https://link.springer.com/article/10.1007/s40685-020-00108-y
60016050,Metal Prices Made in China? A Network Analysis of Industrial Metal Futures,Forschungsartikel (Zeitschrift),10.1002/fut.22125,https://doi.org/10.1002/fut.22125,https://onlinelibrary.wiley.com/doi/10.1002/fut.22125
60004879,Prediction of Player Churn and Disengagement Based on User Activity Data of a Freemium Online Strategy Game,Forschungsartikel (Zeitschrift),10.1109/TG.2020.2992282,https://doi.org/10.1109/TG.2020.2992282,https://ieeexplore.ieee.org/document/9086074/
59996500,Declarative Programming and Knowledge Management,Fachbuch (Herausgegebenes Buch),10.1007/978-3-030-46714-2,https://doi.org/10.1007/978-3-030-46714-2,https://link.springer.com/book/10.1007/978-3-030-46714-2
59995787,Model-Driven Software Development : Cross-Platform App Development and Further Applications of Domain-Specific Languages,"Qualifikationsschrift (Dissertation, Habilitationsschrift)",10.17879/31169712586,https://doi.org/10.17879/31169712586,https://miami.uni-muenster.de/Record/67f368c3-54bc-45df-864c-0797fa657e72
59993130,Evaluation of Success Factors for Public One-Stop Portals and Integrated Portals: A Literature Review,Forschungsartikel in Sammelband (Konferenz),10.30844/wi_2020_r3-grabitz,https://doi.org/10.30844/wi_2020_r3-grabitz,https://library.gito.de/2021/07/wi2020-zentrale-tracks-121/
73998890,Smart Energy Driven Business Model Innovation: An Analysis of Existing Business Models and Implications for Business Model Change in the Energy Sector,Forschungsartikel (Zeitschrift),10.1016/j.jclepro.2020.122083,https://doi.org/10.1016/j.jclepro.2020.122083,https://linkinghub.elsevier.com/retrieve/pii/S0959652620321302
73995721,One PLOT to Show Them All: Visualization of Efficient Sets in Multi-Objective Landscapes,Forschungsartikel in Sammelband (Konferenz),10.1007/978-3-030-58115-2_11,https://doi.org/10.1007/978-3-030-58115-2_11,https://link.springer.com/chapter/10.1007/978-3-030-58115-2_11
73995628,Evolving Sampling Strategies for One-Shot Optimization Tasks,Forschungsartikel in Sammelband (Konferenz),10.1007/978-3-030-58112-1_8,https://doi.org/10.1007/978-3-030-58112-1_8,https://link.springer.com/chapter/10.1007/978-3-030-58112-1_8
73995534,Deep Learning as a Competitive Feature-Free Approach for Automated Algorithm Selection on the Traveling Salesperson Problem,Forschungsartikel in Sammelband (Konferenz),10.1007/978-3-030-58112-1_4,https://doi.org/10.1007/978-3-030-58112-1_4,https://link.springer.com/chapter/10.1007/978-3-030-58112-1_4
73992692,TEN-T corridors – Stairway to heaven or highway to hell?,Forschungsartikel (Zeitschrift),10.1016/j.tra.2020.04.010,https://doi.org/10.1016/j.tra.2020.04.010,https://linkinghub.elsevier.com/retrieve/pii/S0965856420305656
73989461,Assessing Citizens' Non-Adoption of Public E-Services in Germany,Forschungsartikel (Zeitschrift),10.3233/IP-190214,https://doi.org/10.3233/IP-190214,https://www.medra.org/servlet/aliasResolver?alias=iospress&doi=10.3233/IP-190214
73981231,Exploring the Effect of Context Information on Deep Learning Business Process Predictions,Forschungsartikel (Zeitschrift),10.1080/12460125.2020.1790183,https://doi.org/10.1080/12460125.2020.1790183,https://www.tandfonline.com/doi/full/10.1080/12460125.2020.1790183
73977634,Development of a Digital Transformation Maturity Model for IT Companies,Forschungsartikel in Sammelband (Konferenz),10.1109/CBI49978.2020.00018,https://doi.org/10.1109/CBI49978.2020.00018,https://ieeexplore.ieee.org/document/9140273/
73968267,A Classification of Organizational Interventions to Enable Detachment from Work,Forschungsartikel in Sammelband (Konferenz),10.18690/978-961-286-362-3.8,https://doi.org/10.18690/978-961-286-362-3.8,https://press.um.si/index.php/ump/catalog/book/483
73964682,The Role of Marketing in Digital Business Platforms,Forschungsartikel (Zeitschrift),10.1016/j.intmar.2020.04.006,https://doi.org/10.1016/j.intmar.2020.04.006,https://journals.sagepub.com/doi/full/10.1016/j.intmar.2020.04.006
73963700,Which Customers Pay? Predicting Value Pre and Post Sales,Forschungsartikel (Buchbeitrag),10.1007/978-3-658-28137-3,https://doi.org/10.1007/978-3-658-28137-3,https://link.springer.com/book/10.1007/978-3-658-28137-3
73961520,Multikriterielle Bewertung der Energiewende : Nachhaltigkeitsprofile zum Kohleausstieg,Fachbuch (Monographie),10.2312/iass.2020.011,https://doi.org/10.2312/iass.2020.011,https://publications.iass-potsdam.de/pubman/faces/ViewItemOverviewPage.jsp?itemId=item_6000089
73959123,An empirical investigation of performance overhead in cross-platform mobile development frameworks,Forschungsartikel (Zeitschrift),10.1007/s10664-020-09827-6,https://doi.org/10.1007/s10664-020-09827-6,https://link.springer.com/article/10.1007/s10664-020-09827-6
73958936,Bringing Technology and Humanitarian Values Together: A Framework to Design and Assess Humanitarian Information Systems,Forschungsartikel in Sammelband (Konferenz),10.1109/ICT-DM.2017.8275687,https://doi.org/10.1109/ICT-DM.2017.8275687,https://ieeexplore.ieee.org/document/8275687/
73958840,A Multi-method Simulation Environment for Humanitarian Supply Chains,Forschungsartikel in Sammelband (Konferenz),10.1109/ICT-DM.2017.8275677,https://doi.org/10.1109/ICT-DM.2017.8275677,https://ieeexplore.ieee.org/document/8275677/
73958744,Research Directions on Decision Support in Disaster Relief Logistics,Forschungsartikel in Sammelband (Konferenz),10.1109/ICT-DM.2017.8275681,https://doi.org/10.1109/ICT-DM.2017.8275681,https://ieeexplore.ieee.org/document/8275681/
73956655,Determinants of sustainable behavior of firms and the consequences for customer satisfaction in hospitality,Forschungsartikel (Zeitschrift),10.1016/j.ijhm.2020.102515,https://doi.org/10.1016/j.ijhm.2020.102515,https://linkinghub.elsevier.com/retrieve/pii/S0278431920300670
73953761,Leveraging analytics to produce compelling and profitable film content,Forschungsartikel (Zeitschrift),10.1007/s10824-019-09372-1,https://doi.org/10.1007/s10824-019-09372-1,https://link.springer.com/article/10.1007/s10824-019-09372-1
73953042,An unexpectedly large count of trees in the West African Sahara and Sahel,Forschungsartikel (Zeitschrift),10.1038/s41586-020-2824-5,https://doi.org/10.1038/s41586-020-2824-5,https://www.nature.com/articles/s41586-020-2824-5
73950676,What does it take to survive in a digital world? Resource‑based theory and strategic change in the TV industry,Forschungsartikel (Zeitschrift),10.1007/s10824-020-09389-x,https://doi.org/10.1007/s10824-020-09389-x,https://link.springer.com/article/10.1007/s10824-020-09389-x
73949471,The alignment between reported profits and real activity in times of the BEPS Action Plan,Forschungsartikel (Zeitschrift),10.1016/j.intaccaudtax.2020.100330,https://doi.org/10.1016/j.intaccaudtax.2020.100330,https://linkinghub.elsevier.com/retrieve/pii/S1061951820300318
73948933,Pruning Spanners and Constructing Well-Separated Pair Decompositions in the Presence of Memory Hierarchies,Forschungsartikel (Zeitschrift),10.1016/j.jda.2010.03.001,https://doi.org/10.1016/j.jda.2010.03.001,https://linkinghub.elsevier.com/retrieve/pii/S157086671000016X
73948841,Resilient K-d Trees: K-Means in Space Revisited,Forschungsartikel in Sammelband (Konferenz),10.1109/ICDM.2010.94,https://doi.org/10.1109/ICDM.2010.94,https://ieeexplore.ieee.org/document/5694044/
73948749,Detecting Quasars in Large-Scale Astronomical Surveys,Forschungsartikel in Sammelband (Konferenz),10.1109/ICMLA.2010.59,https://doi.org/10.1109/ICMLA.2010.59,https://ieeexplore.ieee.org/document/5708856/
73944873,Challenges and Opportunities for Marketing Scholars in Times of the Fourth Industrial Revolution,Forschungsartikel (Zeitschrift),10.1016/j.intmar.2020.06.001,https://doi.org/10.1016/j.intmar.2020.06.001,https://journals.sagepub.com/doi/full/10.1016/j.intmar.2020.06.001
73943593,Using Weather Forecasts to Forecast Whether Bikes are Used,Forschungsartikel (Zeitschrift),10.1016/j.tra.2020.06.006,https://doi.org/10.1016/j.tra.2020.06.006,https://linkinghub.elsevier.com/retrieve/pii/S0965856420306157
73943138,Does the Tea Market Require a Futures Contract? Evidence from the Sri Lankan Tea Market,Forschungsartikel (Zeitschrift),10.1016/j.ribaf.2020.101290,https://doi.org/10.1016/j.ribaf.2020.101290,https://linkinghub.elsevier.com/retrieve/pii/S0275531920300714
73930195,"From Malthusian disequilibrium to the post-Malthusian era: The evolution of the preventive and positive checks in Germany, 1730–1870",Forschungsartikel (Zeitschrift),10.1007/s13524-020-00872-w,https://doi.org/10.1007/s13524-020-00872-w,https://read.dukeupress.edu/demography/article/57/3/1145/168020/From-Malthusian-Disequilibrium-to-the-Post
73930014,"Economic inequality in Germany, c. 1500–1800",Forschungsartikel (Buchbeitrag),10.36253/978-88-5518-053-5.20,https://doi.org/10.36253/978-88-5518-053-5.20,https://books.fupress.com/catalogue/economic-inequality-in-germany-1500-1800/4326
73928278,EZB-Aktenkauf: Gedankenexperimente beenden!,Forschungsartikel (Zeitschrift),10.1007/s10273-020-2687-2,https://doi.org/10.1007/s10273-020-2687-2,https://link.springer.com/article/10.1007/s10273-020-2687-2
73921856,Perspectives on Information Technology Artefacts in Trust-Related Interactions,Forschungsartikel in Sammelband (Konferenz),10.1007/978-3-030-50309-3_29,https://doi.org/10.1007/978-3-030-50309-3_29,https://link.springer.com/chapter/10.1007/978-3-030-50309-3_29
73903266,Can't Touch This? Conceptualizing the Customer Touchpoint in the Context of Omni-Channel Retailing,Forschungsartikel (Zeitschrift),10.1016/j.jretconser.2020.102269,https://doi.org/10.1016/j.jretconser.2020.102269,https://linkinghub.elsevier.com/retrieve/pii/S0969698920312777
73894992,Exploring Customers' Likeliness to Use E-Service Touchpoints in Brick and Mortar Retail,Forschungsartikel (Zeitschrift),10.1007/s12525-020-00445-0,https://doi.org/10.1007/s12525-020-00445-0,https://link.springer.com/article/10.1007/s12525-020-00445-0
73892140,The Impact of Trustworthiness Perception on Online Recruiting Success,Forschungsartikel in Sammelband (Konferenz),10.5465/AMBPP.2020.18789abstract,https://doi.org/10.5465/AMBPP.2020.18789abstract,https://journals.aom.org/doi/10.5465/AMBPP.2020.18789abstract
73882517,Walking a Mile in Their Shoes—A Citizen Journey to Explore Public Service Delivery from the Citizen Perspective,Forschungsartikel in Sammelband (Konferenz),10.1007/978-3-030-57599-1_13,https://doi.org/10.1007/978-3-030-57599-1_13,https://link.springer.com/chapter/10.1007/978-3-030-57599-1_13
73881876,"Frontline Cyborgs at Your Service: How Human Enhancement
Technologies Affect Customer Experiences in Retail, Sales, and
Service Settings",Forschungsartikel (Zeitschrift),10.1016/j.intmar.2020.03.001,https://doi.org/10.1016/j.intmar.2020.03.001,https://journals.sagepub.com/doi/full/10.1016/j.intmar.2020.03.001
73881695,Transforming the Customer Experience Through New Technologies,Forschungsartikel (Zeitschrift),10.1016/j.intmar.2020.04.001,https://doi.org/10.1016/j.intmar.2020.04.001,https://journals.sagepub.com/doi/full/10.1016/j.intmar.2020.04.001
73856477,Developing an Analytical Framework for Analyzing and Comparing National E-Government Strategies,Forschungsartikel in Sammelband (Konferenz),10.1007/978-3-030-57599-1_2,https://doi.org/10.1007/978-3-030-57599-1_2,https://link.springer.com/chapter/10.1007/978-3-030-57599-1_2
73856291,Nationale E-Government-Strategien: Deutschland und Dänemark im Vergleich,Fachbuch (Monographie),10.30418/2626­6032.2020.11,https://doi.org/10.30418/2626­6032.2020.11,https://doi.org/10.30418/2626%C2%AD6032.2020.11
73853419,Labor Representation in Governance as an Insurance Mechanism,Forschungsartikel (Zeitschrift),10.1093/rof/rfy012,https://doi.org/10.1093/rof/rfy012,https://academic.oup.com/rof/article/22/4/1251/4990928
73853138,"Conglomerate Investment, Skewness, and the CEO Long Shot Bias",Forschungsartikel (Zeitschrift),10.1111/jofi.12379,https://doi.org/10.1111/jofi.12379,https://onlinelibrary.wiley.com/doi/10.1111/jofi.12379
73853043,"Bankers on the Boards of German Firms: What they do, what they are worth, and why they are (still) there",Forschungsartikel (Zeitschrift),10.1093/rof/rfp007,https://doi.org/10.1093/rof/rfp007,https://academic.oup.com/rof/article/14/1/35/1569768
73852948,How Preussag Became TUI: A Clinical Study of Institutional Blockholders and Restructuring in Europe,Forschungsartikel (Zeitschrift),10.1111/j.1755-053X.2008.00025.x,https://doi.org/10.1111/j.1755-053X.2008.00025.x,https://onlinelibrary.wiley.com/doi/10.1111/j.1755-053X.2008.00025.x
73852855,Cause vs. Effect in Context-Sensitive Prediction of Business Process Instances,Forschungsartikel (Zeitschrift),10.1016/j.is.2020.101635,https://doi.org/10.1016/j.is.2020.101635,https://linkinghub.elsevier.com/retrieve/pii/S0306437920301046
73848161,Internationale Mindestbesteuerung von Unternehmen,Nicht-wissenschaftlicher Beitrag (Zeitschrift),10.1007/s10273-019-2505-x,https://doi.org/10.1007/s10273-019-2505-x,https://link.springer.com/article/10.1007/s10273-019-2505-x
73827838,Do not disturb!: trust in decision support systems improves work outcomes under certain conditions,Forschungsartikel in Sammelband (Konferenz),10.1145/3404983.3405515,https://doi.org/10.1145/3404983.3405515,https://dl.acm.org/doi/10.1145/3404983.3405515
73825303,Brave New World? On AI and the Management of Customer Relationships,Forschungsartikel (Zeitschrift),10.1016/j.intmar.2020.04.002,https://doi.org/10.1016/j.intmar.2020.04.002,https://journals.sagepub.com/doi/full/10.1016/j.intmar.2020.04.002
73824188,City 5.0,Forschungsartikel (Zeitschrift),10.1007/s12599-020-00674-9,https://doi.org/10.1007/s12599-020-00674-9,https://link.springer.com/article/10.1007/s12599-020-00674-9
73822638,Literature Review on Maturity Models for Digital Supply Chains,Forschungsartikel (Zeitschrift),10.14488/BJOPM.2021.022,https://doi.org/10.14488/BJOPM.2021.022,https://bjopm.org.br/bjopm/article/view/1127
73815689,Per-Instance Configuration of the Modularized CMA-ES by Means of Classifier Chains and Exploratory Landscape Analysis,Forschungsartikel in Sammelband (Konferenz),10.1109/SSCI47803.2020.9308510,https://doi.org/10.1109/SSCI47803.2020.9308510,https://ieeexplore.ieee.org/document/9308510/
73815600,Multiobjectivization of Local Search: Single-Objective Optimization Benefits From Multi-Objective Gradient Descent,Forschungsartikel in Sammelband (Konferenz),10.1109/SSCI47803.2020.9308259,https://doi.org/10.1109/SSCI47803.2020.9308259,https://ieeexplore.ieee.org/document/9308259/
73813986,"A deferred acceptance mechanism for decentralized fast, and fair childcare assignmen",Forschungsartikel (Zeitschrift),10.22574/jmid.2021.12.003,https://doi.org/10.22574/jmid.2021.12.003,http://www.mechanism-design.org/arch/v006-1/p_03.pdf
73813535,A Systematic Literature Review on General Parameter Control for Evolutionary and Swarm-based Algorithms,Forschungsartikel (Buchbeitrag),10.1016/j.swevo.2020.100777,https://doi.org/10.1016/j.swevo.2020.100777,https://linkinghub.elsevier.com/retrieve/pii/S2210650220304302
73813161,A Two-Phase Framework for Detecting Manipulation Campaigns in Social Media,Forschungsartikel in Sammelband (Konferenz),10.1007/978-3-030-49570-1_14,https://doi.org/10.1007/978-3-030-49570-1_14,https://link.springer.com/chapter/10.1007/978-3-030-49570-1_14
73802818,Implementation of BFASTmonitor Algorithm on Google Earth Engine to Support Large-Area and Sub-Annual Change Monitoring Using Earth Observation Data,Forschungsartikel (Zeitschrift),10.3390/rs12182953,https://doi.org/10.3390/rs12182953,https://www.mdpi.com/2072-4292/12/18/2953
73795127,Adopting Learning Analytics To Inform Postgraduate Curriculum Design,Forschungsartikel in Sammelband (Konferenz),10.1007/978-3-030-64849-7_20,https://doi.org/10.1007/978-3-030-64849-7_20,https://link.springer.com/chapter/10.1007/978-3-030-64849-7_20
73791704,Künstliche Intelligenz: Begriffsklärungen und technische Einschätzungen als Grundlage für Regulierungsansätze,Forschungsartikel (Buchbeitrag),10.3790/978-3-428-55963-3,https://doi.org/10.3790/978-3-428-55963-3,https://elibrary.duncker-humblot.com/book/54409/digitalisierung-und-kunstliche-intelligenz
73784544,S&OP as Driver for Sustainability,Forschungsartikel (Buchbeitrag),10.1007/978-3-030-78570-3_10,https://doi.org/10.1007/978-3-030-78570-3_10,https://link.springer.com/chapter/10.1007/978-3-030-78570-3_10
73784357,Uncovering the business value of the internet of things in the energy domain – a review of smart energy business models,Forschungsartikel (Zeitschrift),10.1007/s12525-019-00381-8,https://doi.org/10.1007/s12525-019-00381-8,https://link.springer.com/article/10.1007/s12525-019-00381-8
73783995,Cartesian Genetic Programming Hyper-Heuristic with Parameter Configuration for Production Lot-Sizing,Forschungsartikel in Sammelband (Konferenz),10.1109/CEC48606.2020.9185602,https://doi.org/10.1109/CEC48606.2020.9185602,https://ieeexplore.ieee.org/document/9185602/
73783712,On the Sensitivity Analysis of Cartesian Genetic Programming Hyper-Heuristic,Forschungsartikel in Sammelband (Konferenz),10.1145/3377929.3398142,https://doi.org/10.1145/3377929.3398142,https://dl.acm.org/doi/10.1145/3377929.3398142
73782014,Creating Cloud-Free Satellite Imagery from Image Time Series with Deep Learning,Forschungsartikel in Sammelband (Konferenz),10.1145/3423336.3429345,https://doi.org/10.1145/3423336.3429345,https://dl.acm.org/doi/10.1145/3423336.3429345
73776864,"Some people feel the rain, others just get wet: An analysis of regional differences in the effects of weather on cycling",Forschungsartikel (Zeitschrift),10.1016/j.rtbm.2020.100541,https://doi.org/10.1016/j.rtbm.2020.100541,https://linkinghub.elsevier.com/retrieve/pii/S2210539520300900
73775693,The Link Between Operational Leanness and Credit Ratings,Forschungsartikel (Zeitschrift),10.1016/j.jom.2016.11.001,https://doi.org/10.1016/j.jom.2016.11.001,https://onlinelibrary.wiley.com/resolve/doi?DOI=10.1016/j.jom.2016.11.001
73774972,Performance Implications of Cross-Functional Coopetition in New Product Development: The Mediating Role of Organizational Learning,Forschungsartikel (Zeitschrift),10.1016/j.indmarman.2018.02.007,https://doi.org/10.1016/j.indmarman.2018.02.007,https://linkinghub.elsevier.com/retrieve/pii/S0019850118300919
73774881,Inventory Component Volatility and Its Relation to Returns,Forschungsartikel (Zeitschrift),10.1016/j.ijpe.2018.03.012,https://doi.org/10.1016/j.ijpe.2018.03.012,https://linkinghub.elsevier.com/retrieve/pii/S0925527318301294
73774790,On Micro-foundations of Dynamic Capabilities: A Multi-Level Perspective Based on CEO Personality and Knowledge-based Capital,Forschungsartikel (Zeitschrift),10.1016/j.lrp.2017.08.002,https://doi.org/10.1016/j.lrp.2017.08.002,https://linkinghub.elsevier.com/retrieve/pii/S0024630117303254
73774699,Share Repurchases and Myopia: Implications on the Stock and Consumer Markets,Forschungsartikel (Zeitschrift),10.1509/jm.16.0200,https://doi.org/10.1509/jm.16.0200,https://journals.sagepub.com/doi/10.1509/jm.16.0200
73774609,Social Capital and the Digital Crowd: Involving Backers to Promote New Product Innovativeness,Forschungsartikel (Zeitschrift),10.1016/j.respol.2019.01.017,https://doi.org/10.1016/j.respol.2019.01.017,https://linkinghub.elsevier.com/retrieve/pii/S0048733319300265
73774515,The Supply Side: Profiling Crowdfunders,Forschungsartikel (Buchbeitrag),10.4337/9781788117210.00011,https://doi.org/10.4337/9781788117210.00011,https://www.elgaronline.com/view/edcoll/9781788117203/9781788117203.00011.xml
73774329,Culture and Cross-functional Coopetition: The Interplay of Organizational and National Culture,Forschungsartikel (Zeitschrift),10.1016/j.intman.2019.100731,https://doi.org/10.1016/j.intman.2019.100731,https://linkinghub.elsevier.com/retrieve/pii/S1075425319300249
73774238,The Effect of Family Involvement on Innovation Outcomes: The Moderating Role of Board Social Capital,Forschungsartikel (Zeitschrift),10.1111/jpim.12522,https://doi.org/10.1111/jpim.12522,https://onlinelibrary.wiley.com/doi/10.1111/jpim.12522
73774147,The Influence of Internal Social Capital on Serial Creators' Success in Crowdfunding,Forschungsartikel (Zeitschrift),10.1111/etap.12272,https://doi.org/10.1111/etap.12272,https://journals.sagepub.com/doi/10.1111/etap.12272
73768611,Building an Equity Story: The Impact of Effectuation on Business Angel Investments,Forschungsartikel (Zeitschrift),10.1007/s11573-017-0868-2,https://doi.org/10.1007/s11573-017-0868-2,https://link.springer.com/article/10.1007/s11573-017-0868-2
73768343,Towards a Technology-Oriented Theory of Production,Forschungsartikel (Buchbeitrag),10.1007/978-3-319-47452-6_12,https://doi.org/10.1007/978-3-319-47452-6_12,https://link.springer.com/chapter/10.1007/978-3-319-47452-6_12
73766606,Attention as Activation,Forschungsartikel in Sammelband (Konferenz),10.1109/ICPR48806.2021.9413020,https://doi.org/10.1109/ICPR48806.2021.9413020,https://ieeexplore.ieee.org/document/9413020/
73758509,Approximate Nearest-Neighbour Fields via Massively-Parallel Propagation-Assisted K-D Trees,Forschungsartikel in Sammelband (Konferenz),10.1109/BigData50022.2020.9378426,https://doi.org/10.1109/BigData50022.2020.9378426,https://ieeexplore.ieee.org/document/9378426/
73754677,A Nozickian Case for Compulsory Employment Injury Insurance: The Example of Sweatshops,Forschungsartikel (Zeitschrift),10.1007/s10551-020-04535-z,https://doi.org/10.1007/s10551-020-04535-z,https://link.springer.com/article/10.1007/s10551-020-04535-z
73754311,Applications of Artificial Intelligence in Supply Chain Management and Logistics: Focusing Onto Recognition for Supply Chain Execution,Forschungsartikel (Buchbeitrag),10.1007/978-3-030-06234-7_27,https://doi.org/10.1007/978-3-030-06234-7_27,https://link.springer.com/chapter/10.1007/978-3-030-06234-7_27
73749080,Social media resources and capabilities as strategic determinants of social media performance,Forschungsartikel (Zeitschrift),10.1016/j.ijresmar.2020.09.011,https://doi.org/10.1016/j.ijresmar.2020.09.011,https://linkinghub.elsevier.com/retrieve/pii/S0167811620300872
73748892,Digital Work and Organisational Transformation: Emergent Digital/Human Work Configurations in Modern Organisations: Editorial: Special Issue on Strategic Perspectives on Digital Work and Organisational Transformation,Forschungsartikel (Zeitschrift),10.1016/j.jsis.2020.101618,https://doi.org/10.1016/j.jsis.2020.101618,https://linkinghub.elsevier.com/retrieve/pii/S0963868720300263
73748705,Robo-apocalypse cancelled?,Forschungsartikel (Zeitschrift),10.1177/0268396220925096,https://doi.org/10.1177/0268396220925096,https://journals.sagepub.com/doi/10.1177/0268396220925096
73747423,Do political parties matter? Evidence from German municipalities,Forschungsartikel (Zeitschrift),10.15456/ger.2020266.102742,https://doi.org/10.15456/ger.2020266.102742,https://journaldata.zbw.eu/dataset/do-political-parties-matter-evidence-from-german-municipalities
73746426,An approach to increasing forecast-combination accuracy through VAR error modeling,Forschungsartikel (Zeitschrift),10.1002/for.2733,https://doi.org/10.1002/for.2733,https://onlinelibrary.wiley.com/doi/10.1002/for.2733
73746336,"Are multifractal processes suited to forecasting electricity price volatility?
Evidence from Australian intraday data",Forschungsartikel (Zeitschrift),10.1515/snde-2019-0009,https://doi.org/10.1515/snde-2019-0009,https://www.degruyter.com/document/doi/10.1515/snde-2019-0009/html
73738681,Business models in process industries: Emerging trends and future research,Forschungsartikel (Zeitschrift),10.1016/j.technovation.2020.102195,https://doi.org/10.1016/j.technovation.2020.102195,https://linkinghub.elsevier.com/retrieve/pii/S0166497220300675
73732994,Attentional Feature Fusion,Forschungsartikel in Sammelband (Konferenz),10.1109/WACV48630.2021.00360,https://doi.org/10.1109/WACV48630.2021.00360,https://ieeexplore.ieee.org/document/9423114/
73732276,Information Transmission under Increasing Political Tension - Evidence for the Berlin Produce Exchange 1887-1896,Forschungsartikel (Zeitschrift),10.1002/fut.22172,https://doi.org/10.1002/fut.22172,https://onlinelibrary.wiley.com/doi/10.1002/fut.22172
